{
  "schema_version": 1,
  "ledger_kind": "project_index_with_authoritative_imports",
  "compatibility_specification": "observable OCaml behavior for the pinned HOL Light/Flyspeck subset",
  "source_provenance": {
    "selected_direct_source": {
      "role": "direct_s3_clean_upstream",
      "repository": "flyspeck",
      "path_key": "../worktrees/flyspeck-v13-source",
      "git_commit": "1ce0353008eba83d3c76ae9a25c3c242e4802d53"
    },
    "separate_development_source": {
      "role": "pft_development",
      "repository": "flyspeck",
      "git_commit": "2ea440e9f7c55734d1e47738e44a6129ce0ecf5a",
      "included_in_selected_inventory": false
    },
    "inventory_artifacts": {
      "findings_sha256": "e2af1fad83d1b0e3ba6e4bb7033470f770e0874371e8de5ef3e242ba120f1bdb",
      "pointer_triage_sha256": "f1f6d6d16ffdc346d500b558e01db7b1aa86057034966d3e73c8d82dab2a3f73",
      "ffi_triage_sha256": "9d3df0a9a45c93d09ffc95f0a9dd753ef068bf16c7d2c9e82bdef4281f3e3ce4",
      "direct_closure_sha256": "4c256fac8c953288e35a31773d50b12a7c3d918a072237743fff58b1a352e6eb",
      "pin_contract_sha256": "7a5dec1222048bbce2dcfc2a190fd5d0f4945e9c3a8dd4339eb0eb4b6002423f",
      "pin_delta_sha256": "13764f7d73d4c9e7517a98f4385506580afb473b1ad39ba569a49f83e030954e"
    }
  },
  "import_contract": {
    "entry_identity": "The authoritative source ledger owns its entry bodies and IDs; this project index records only immutable source coordinates, digests, field mappings, and entry IDs.",
    "merge_key": "id",
    "duplicate_policy": "reject duplicate IDs across local and imported ledgers",
    "update_policy": "advance an import only by changing its git commit, artifact digest, declared entry IDs, and any schema-adapter notes in one reviewed commit",
    "projection_policy": "source-native fields remain authoritative; field_map documents the lossless v1.3 projection and schema_gaps documents work still needed at the source"
  },
  "imports": [
    {
      "id": "candle-native-compatibility-ledger",
      "repository_path_key": "candle",
      "git_commit": "2306980c0c76f9e5c9a30e259694d4044110fab1",
      "artifact_path": "candle/compatibility/ledger.json",
      "artifact_sha256": "94eeeacd5efb8a151492ad8565e9f5854a3aa02385c9b375cdacf36112ca23da",
      "source_schema_version": 1,
      "authoritative_id_prefix": "CANDLE-",
      "entry_ids": [
        "CANDLE-OCAML-FLOAT-LITERAL-001"
      ],
      "field_map": {
        "semantic_category": "category",
        "status": "status",
        "minimal_reproducer": "minimal_reproducer",
        "ocaml_reference": "ocaml_reference",
        "candle_outcome": "candle_observation",
        "chosen_remedy": "candidate_remedy",
        "proof_obligation": "proof_obligation",
        "regression_requirement": "regression_requirement",
        "affected_corpus_locations": "affected_source_locations"
      },
      "schema_gaps": [
        "The source ledger has a regression requirement but not yet one or more stable regression IDs.",
        "Remedy and proof-obligation lifecycle statuses are not yet separate source fields.",
        "Affected targets/locations are source strings rather than repository-qualified location objects."
      ]
    }
  ],
  "related_artifacts": [
    {
      "id": "candle-great100-target-manifest",
      "repository_path_key": "candle",
      "git_commit": "2306980c0c76f9e5c9a30e259694d4044110fab1",
      "artifact_path": "candle/top100_manifest.json",
      "artifact_sha256": "e936a0a9d097b1e8410911b505773b28a92c91c62ced322041526df834c430e2",
      "schema_version": 1,
      "declared_target_count": 65,
      "declared_source_count": 66,
      "relationship": "Authoritative Candle-native target inventory; compatibility findings link to its stable target names rather than cloning the manifest."
    }
  ],
  "entries": [
    {
      "id": "PROJECT-OPEN-DECLARATION-REVIEW-001",
      "entry_kind": "inventory_review",
      "divergence_state": "review_candidate",
      "priority": "P0",
      "status": "proof_pending",
      "summary": "Determine the accepted declaration-open and module-path subset from pinned source occurrences",
      "semantic_category": "syntax.name_resolution.open.declaration",
      "minimal_reproducer": {"status": "ready", "path": "compatibility/oracles/open_declaration.ml"},
      "ocaml_reference": {"status": "observed", "outcome": "OCaml 4.14.1 opens the module and resolves the subsequent unqualified value to 7", "evidence": ["ocaml -noinit -noprompt compatibility/oracles/open_declaration.ml => OPEN_DECLARATION_ORACLE_OK"]},
      "candle_outcome": {"status": "observed", "outcome": "The clean compiled Candle frontend rejects the declaration before evaluating the unqualified value; the direct Flyspeck route reaches the same error at debug.hl:16", "evidence": ["clean compiled Candle c20b3ec65fc01b6f50a0101c706e18271920530030aa3c381a36ff0fdbd3b23f => open-declarations are not supported (yet)", "clean direct frontier log SHA-256 04d875c82cfa943701be5e78d22bc78853d47fb3d314fe9f3de7abd0e4cf3dbb"]},
      "chosen_remedy": {"status": "chosen", "kind": "verified_dopen_frontend_inference_semantics_and_backend_integration", "description": "Integrate declaration-open as Dopen through parsing, inference, soundness/completeness, CV, semantics, backend, bootstrap, and a compiled corpus-derived gate; do not qualify thousands of Flyspeck names by source rewrite."},
      "proof_obligation": {"status": "open", "description": "Build the verified inference stack and compiler, pass the minimal OCaml differential, and match OCaml/HOL Light fingerprints on a real open-dependent slice derived from the exact 3,180-site direct corpus. Synthetic parser success alone does not discharge G2.", "evidence": ["Candle 921e7f2 dopen_corpus_contract: 3,180 opens, 234 files, 193 module paths, site SHA-256 bce30814051df12ea23c14f2918a55e6b839b72760fd58b8996e32f1c05bf282", "docs/requirements-v1.3.md: G2 Dopen"]},
      "regression_ids": ["CAKEML-DOPEN-MINIMAL-001", "CANDLE-FLYSPECK-DOPEN-CORPUS-001"],
      "affected_corpus_files": [],
      "affected_files_status": "inventory_query",
      "inventory_selector": {"categories": ["open.declaration"]},
      "notes": "The exact direct projection selects 3,180 declarations in 234 files from the broad inventory and matches the separate manifest Dopen site digest. This remains a review_candidate until verified integration and semantic regressions pass."
    },
    {
      "id": "PROJECT-LOCAL-OPEN-REVIEW-001",
      "entry_kind": "inventory_review",
      "divergence_state": "equivalent_behavior",
      "priority": "P0",
      "status": "resolved",
      "summary": "Accept and gate the exact 79 selected operator-reference local opens; reject broader unselected forms",
      "semantic_category": "syntax.name_resolution.open.local",
      "minimal_reproducer": {"status": "ready", "path": "compatibility/oracles/open_local_parenthesized.ml"},
      "ocaml_reference": {"status": "observed", "outcome": "OCaml 4.14.1 resolves simple and dotted M.(operator) references to the module binding despite conflicting outer operators, and evaluates the separate M.(general expression) oracle with local-open resolution", "evidence": ["scripts/test-local-open-compatibility.sh => selected operator-reference oracle and general-expression reference oracle pass"]},
      "candle_outcome": {"status": "observed", "outcome": "The clean compiled Candle executable matches OCaml for the selected operator-reference shape, including dotted paths and shadowing; it fails closed on the broader unselected M.(general expression) shape with Undefined variable: Array.get", "evidence": ["scripts/test-local-open-compatibility.sh against clean executable SHA-256 c20b3ec65fc01b6f50a0101c706e18271920530030aa3c381a36ff0fdbd3b23f", "compatibility/oracles/open_local_parenthesized_general.ml => pinned negative divergence"]},
      "chosen_remedy": {"status": "implemented", "kind": "exact_selected_syntax_subset", "description": "Accept the already supported M.(operator) form and gate the direct manifest to exactly that body shape; do not claim or enable the broader M.(general expression) form."},
      "proof_obligation": {"status": "discharged", "description": "For the selected direct closure only, prove every occurrence has the supported operator-reference shape and pin differential name-resolution behavior plus the known broader negative boundary.", "evidence": ["direct compatibility closure SHA-256 4c256fac8c953288e35a31773d50b12a7c3d918a072237743fff58b1a352e6eb: 79 operator_reference, zero general_expression", "scripts/test-local-open-compatibility.sh"]},
      "regression_ids": ["CANDLE-LOCAL-OPEN-OPERATOR-001", "CANDLE-LOCAL-OPEN-GENERAL-NEGATIVE-001"],
      "affected_corpus_files": [],
      "affected_files_status": "inventory_query",
      "inventory_selector": {"categories": ["open.local_let", "open.local_parenthesized"]},
      "notes": "Exact manifest projection finds zero selected let-open occurrences and 79 parenthesized local opens in 23 files: 78 in the base stratum and one in LP support. Inventory generator v2 classifies all 79 as operator references. The seven broad-inventory general-expression sites are outside the selected 400-node closure and remain an explicitly tested Candle divergence; any selected general-expression occurrence reopens this entry."
    },
    {
      "id": "PROJECT-MODULE-CONSTRUCT-REVIEW-001",
      "entry_kind": "inventory_review",
      "divergence_state": "equivalent_behavior",
      "priority": "P0",
      "status": "resolved",
      "summary": "Accept and gate the exact selected ordinary module subset; track its single functor-application exception separately",
      "semantic_category": "syntax.modules",
      "minimal_reproducer": {"status": "ready", "path": "compatibility/oracles/module_selected_supported.ml"},